{
	"$schema": "http://json-schema.org/draft-07/schema#",
	"$id": "/test/Ex",
	"title": "Ex",
	"description": "An Ex organism",
	"type": "object",
	"properties": {
		"modifier": {
			"description": "A modifier",
			"enum": ["", "blue"]
		},
		"title": {
			"description": "Title of the pattern",
			"type": "string",
			"minLength": 3,
			"maxLength": 100
		},
		"links": {
			"description": "An array of links",
			"type": "array",
			"minItems": 1,
			"items": {
				"$ref": "/test/Ex/Ex-link"
			}
		},
		"buttons": {
			"description": "a boolean",
			"type": "boolean"
		},
		"subpattern": {
			"$ref": "/test/t"
		}
	},
	"required": ["title", "links"]
}
